{
  "estimate_id": "THIN-SKIN-GUITAR-BUILD-ESTIMATE-VARIANT-A-V1",
  "product_id": "PRODUCT-THIN-SKIN-ELECTRIC-GUITAR-BASELINE-V1",
  "product_ref": "fixtures/products/thin_skin_electric_guitar_baseline_v1.json",
  "variant_id": "VARIANT-A-PLYWOOD-CORE",
  "variant_description": "Hardboard/HDF skins over a birch plywood structural core",
  "estimate_input_id": "THIN-SKIN-ESTIMATE-INPUT-VARIANT-A-PLYWOOD-CORE-V1",
  "estimate_input_ref": "fixtures/estimates/guitar/thin_skin_variant_a_input_v1.json",
  "status": "draft",
  "quantity": 1,
  "currency": "USD",
  "cost_summary": {
    "core_material_cost": 10.56,
    "skin_material_cost": 3.38,
    "adhesive_and_lamination_consumables": 4.7,
    "neck_and_fretboard_cost": 63.25,
    "hardware_cost": 49.1,
    "electronics_cost": 72.0,
    "finish_material_cost": 53.5,
    "other_consumables_cost": 25.8,
    "machine_time_cost": 46.35,
    "equipment_occupancy_cost": 12.13,
    "lamination_labor_cost": 29.23,
    "direct_build_labor_cost": 119.32,
    "finishing_labor_cost": 75.23,
    "assembly_labor_cost": 52.7,
    "setup_and_inspection_cost": 36.89,
    "material_scrap_allowance": 5.61,
    "process_rework_and_yield_reserve": 41.14,
    "total_direct_manufacturing_cost": 700.89
  },
  "time_summary": {
    "total_labor_minutes": 654.0,
    "total_machine_runtime_minutes": 96.0,
    "total_equipment_occupancy_minutes": 3050.0,
    "total_elapsed_wait_minutes": 315.0,
    "total_rework_minutes": 0.0,
    "lamination_labor_minutes": 61.0,
    "direct_build_labor_minutes": 249.0,
    "finishing_labor_minutes": 157.0,
    "assembly_labor_minutes": 110.0,
    "setup_and_inspection_minutes": 77.0
  },
  "risk_basis": {
    "material_scrap_rate": 0.05,
    "material_scrap_base": 112.14,
    "process_reserve_rate": 0.1,
    "process_reserve_material_base": 129.14,
    "process_reserve_machine_base": 46.35,
    "process_reserve_equipment_base": 12.13,
    "process_reserve_labor_base": 223.78,
    "process_reserve_base": 411.4,
    "compounding": "material_scrap_allowance is excluded from the process reserve base; the two risk mechanisms do not compound"
  },
  "operation_results": [
    {
      "operation_id": "OP-1100",
      "wbs_code": "1100",
      "labor_category": "direct_build_labor",
      "attendance": "attended",
      "labor_minutes": 23.0,
      "machine_runtime_minutes": 0.0,
      "equipment_occupancy_minutes": 0.0,
      "elapsed_wait_minutes": 0.0,
      "rework_minutes": 0.0,
      "equipment_id": "",
      "labor_cost": 11.02,
      "machine_time_cost": 0.0,
      "equipment_occupancy_cost": 0.0,
      "operation_cost": 11.02
    },
    {
      "operation_id": "OP-1200",
      "wbs_code": "1200",
      "labor_category": "direct_build_labor",
      "attendance": "attended",
      "labor_minutes": 18.0,
      "machine_runtime_minutes": 0.0,
      "equipment_occupancy_minutes": 0.0,
      "elapsed_wait_minutes": 0.0,
      "rework_minutes": 0.0,
      "equipment_id": "",
      "labor_cost": 8.62,
      "machine_time_cost": 0.0,
      "equipment_occupancy_cost": 0.0,
      "operation_cost": 8.62
    },
    {
      "operation_id": "OP-1300",
      "wbs_code": "1300",
      "labor_category": "setup_and_inspection",
      "attendance": "attended",
      "labor_minutes": 10.0,
      "machine_runtime_minutes": 0.0,
      "equipment_occupancy_minutes": 0.0,
      "elapsed_wait_minutes": 0.0,
      "rework_minutes": 0.0,
      "equipment_id": "",
      "labor_cost": 4.79,
      "machine_time_cost": 0.0,
      "equipment_occupancy_cost": 0.0,
      "operation_cost": 4.79
    },
    {
      "operation_id": "OP-2100",
      "wbs_code": "2100",
      "labor_category": "lamination_labor",
      "attendance": "attended",
      "labor_minutes": 10.0,
      "machine_runtime_minutes": 0.0,
      "equipment_occupancy_minutes": 0.0,
      "elapsed_wait_minutes": 0.0,
      "rework_minutes": 0.0,
      "equipment_id": "",
      "labor_cost": 4.79,
      "machine_time_cost": 0.0,
      "equipment_occupancy_cost": 0.0,
      "operation_cost": 4.79
    },
    {
      "operation_id": "OP-2200",
      "wbs_code": "2200",
      "labor_category": "lamination_labor",
      "attendance": "attended",
      "labor_minutes": 17.0,
      "machine_runtime_minutes": 0.0,
      "equipment_occupancy_minutes": 0.0,
      "elapsed_wait_minutes": 0.0,
      "rework_minutes": 0.0,
      "equipment_id": "",
      "labor_cost": 8.15,
      "machine_time_cost": 0.0,
      "equipment_occupancy_cost": 0.0,
      "operation_cost": 8.15
    },
    {
      "operation_id": "OP-2300",
      "wbs_code": "2300",
      "labor_category": "lamination_labor",
      "attendance": "attended",
      "labor_minutes": 20.0,
      "machine_runtime_minutes": 0.0,
      "equipment_occupancy_minutes": 20.0,
      "elapsed_wait_minutes": 0.0,
      "rework_minutes": 0.0,
      "equipment_id": "EQUIPMENT-VACUUM-PRESS-V1",
      "labor_cost": 9.58,
      "machine_time_cost": 0.0,
      "equipment_occupancy_cost": 0.46,
      "operation_cost": 10.04
    },
    {
      "operation_id": "OP-2400",
      "wbs_code": "2400",
      "labor_category": "lamination_labor",
      "attendance": "queue_or_cure",
      "labor_minutes": 0.0,
      "machine_runtime_minutes": 0.0,
      "equipment_occupancy_minutes": 90.0,
      "elapsed_wait_minutes": 0.0,
      "rework_minutes": 0.0,
      "equipment_id": "EQUIPMENT-VACUUM-PRESS-V1",
      "labor_cost": 0.0,
      "machine_time_cost": 0.0,
      "equipment_occupancy_cost": 2.07,
      "operation_cost": 2.07
    },
    {
      "operation_id": "OP-2500",
      "wbs_code": "2500",
      "labor_category": "lamination_labor",
      "attendance": "attended",
      "labor_minutes": 14.0,
      "machine_runtime_minutes": 0.0,
      "equipment_occupancy_minutes": 8.0,
      "elapsed_wait_minutes": 0.0,
      "rework_minutes": 0.0,
      "equipment_id": "EQUIPMENT-VACUUM-PRESS-V1",
      "labor_cost": 6.71,
      "machine_time_cost": 0.0,
      "equipment_occupancy_cost": 0.18,
      "operation_cost": 6.89
    },
    {
      "operation_id": "OP-3100",
      "wbs_code": "3100",
      "labor_category": "direct_build_labor",
      "attendance": "attended",
      "labor_minutes": 18.0,
      "machine_runtime_minutes": 15.0,
      "equipment_occupancy_minutes": 0.0,
      "elapsed_wait_minutes": 0.0,
      "rework_minutes": 0.0,
      "equipment_id": "",
      "labor_cost": 8.62,
      "machine_time_cost": 7.24,
      "equipment_occupancy_cost": 0.0,
      "operation_cost": 15.86
    },
    {
      "operation_id": "OP-3200",
      "wbs_code": "3200",
      "labor_category": "direct_build_labor",
      "attendance": "partially_attended",
      "labor_minutes": 3.0,
      "machine_runtime_minutes": 9.0,
      "equipment_occupancy_minutes": 0.0,
      "elapsed_wait_minutes": 0.0,
      "rework_minutes": 0.0,
      "equipment_id": "",
      "labor_cost": 1.44,
      "machine_time_cost": 4.35,
      "equipment_occupancy_cost": 0.0,
      "operation_cost": 5.79
    },
    {
      "operation_id": "OP-3300",
      "wbs_code": "3300",
      "labor_category": "direct_build_labor",
      "attendance": "partially_attended",
      "labor_minutes": 3.0,
      "machine_runtime_minutes": 11.0,
      "equipment_occupancy_minutes": 0.0,
      "elapsed_wait_minutes": 0.0,
      "rework_minutes": 0.0,
      "equipment_id": "",
      "labor_cost": 1.44,
      "machine_time_cost": 5.31,
      "equipment_occupancy_cost": 0.0,
      "operation_cost": 6.75
    },
    {
      "operation_id": "OP-3400",
      "wbs_code": "3400",
      "labor_category": "direct_build_labor",
      "attendance": "partially_attended",
      "labor_minutes": 2.0,
      "machine_runtime_minutes": 4.0,
      "equipment_occupancy_minutes": 0.0,
      "elapsed_wait_minutes": 0.0,
      "rework_minutes": 0.0,
      "equipment_id": "",
      "labor_cost": 0.96,
      "machine_time_cost": 1.93,
      "equipment_occupancy_cost": 0.0,
      "operation_cost": 2.89
    },
    {
      "operation_id": "OP-3500",
      "wbs_code": "3500",
      "labor_category": "direct_build_labor",
      "attendance": "partially_attended",
      "labor_minutes": 2.0,
      "machine_runtime_minutes": 5.0,
      "equipment_occupancy_minutes": 0.0,
      "elapsed_wait_minutes": 0.0,
      "rework_minutes": 0.0,
      "equipment_id": "",
      "labor_cost": 0.96,
      "machine_time_cost": 2.41,
      "equipment_occupancy_cost": 0.0,
      "operation_cost": 3.37
    },
    {
      "operation_id": "OP-3600",
      "wbs_code": "3600",
      "labor_category": "direct_build_labor",
      "attendance": "attended",
      "labor_minutes": 26.0,
      "machine_runtime_minutes": 0.0,
      "equipment_occupancy_minutes": 0.0,
      "elapsed_wait_minutes": 0.0,
      "rework_minutes": 0.0,
      "equipment_id": "",
      "labor_cost": 12.46,
      "machine_time_cost": 0.0,
      "equipment_occupancy_cost": 0.0,
      "operation_cost": 12.46
    },
    {
      "operation_id": "OP-4100",
      "wbs_code": "4100",
      "labor_category": "direct_build_labor",
      "attendance": "partially_attended",
      "labor_minutes": 30.0,
      "machine_runtime_minutes": 52.0,
      "equipment_occupancy_minutes": 0.0,
      "elapsed_wait_minutes": 0.0,
      "rework_minutes": 0.0,
      "equipment_id": "",
      "labor_cost": 14.38,
      "machine_time_cost": 25.11,
      "equipment_occupancy_cost": 0.0,
      "operation_cost": 39.49
    },
    {
      "operation_id": "OP-4200",
      "wbs_code": "4200",
      "labor_category": "direct_build_labor",
      "attendance": "attended",
      "labor_minutes": 78.0,
      "machine_runtime_minutes": 0.0,
      "equipment_occupancy_minutes": 0.0,
      "elapsed_wait_minutes": 0.0,
      "rework_minutes": 0.0,
      "equipment_id": "",
      "labor_cost": 37.38,
      "machine_time_cost": 0.0,
      "equipment_occupancy_cost": 0.0,
      "operation_cost": 37.38
    },
    {
      "operation_id": "OP-4300",
      "wbs_code": "4300",